Cleaned_Questions,Cleaned_Answers,Question_Word_Count,Answer_Word_Count,Contains_Mental_Health_Topic
im young person one parent mental illness,someone elses illness fault also cant control someone else feel illness thing say take care learning parent illness make bit easier understand experience website find easytoread booklet mental illness well longer info sheet many different mental illness also find information young people centre addiction mental health important take care lot people big mix feeling parent isnt well might feel angry embarrassed scared many thing feeling experience big impact way think people youre airplane flight attendant go safety demonstration tell put oxygen mask help people thats hard help someone else arent well program specifically young people kid control support group program bc schizophrenia society help child youth age understand mental illness cope challenge take care health wellbeing kid control currently available local branch branch order material work super saturday club cmha vancouverfraser free recreation group child youth age parent experience mental illness learn visit wwwvancouverfrasercmhabcca youre trouble coping something going home ask help place go teacher counsellor school adult trust like friend parent another family member kid help phone visit wwwkidshelpphoneca learn taking care chat counsellor call talk counsellor youthinbc visit wwwyouthinbccom chat trained volunteer noonam pacific time bc mental health support line ever need talk someone youd like see kind resource community call area code time,7,206,False
thought suicide someone care talking suicide,need talk someone arent sure help someone care call suicide time type concern using live chat like texting online wwwcrisiscentrechatca noon help suggest good local resource youre risk harm think someone else danger need help right call scary thought suicide hear someone care thought suicide thought suicide dont mean someone end life sign need extra help support thought suicide important talk doctor mental health service provider youre supporting someone else encourage seek help coping suicidal thought good resource help understand manage difficult feeling info sheet suicide information suicide helping someone else finding help suicide booklet audio plain language lower literacy reader centre suicide prevention many resource toolkits suicide different audience including people serving military young people teen older adult aboriginal community member lgbt community member,6,125,False
cannabis legally allowed doctor group saying potentially harmful age use certain use whats myth whats fact im parent tell young adult,using cannabis potential benefit harm young people use cannabis like psychoactive drug feel good feel better better explore trying cannabis curiosity experiment socializing friend related moderate use lower potential harm using cannabis cope daily life deal unpleasant feeling fit social group higher potential harm dealing kind issue associated frequent heavier use less thought potential harm little consideration alternative coping talking parent trusted adult physical activity friend evidence suggests younger person start using cannabis often use greater potential harm legal age use cannabis bc however brain finish developing age delaying cannabis use early adulthood may reduce potential harmful effect brain young people especially many factor predisposing serious persistent mental health issue probably use cannabis cannabis associated increased risk psychosis schizophrenia small group people people serious mental health issue also reported using cannabis helped cope illness helping feel less anxious stressed situation balancing potential benefit harm using cannabis key young people serious mental health concern mixing drug cannabis alcohol also increase possibility experiencing harm intoxication may intense long lasting young person may appreciate impaired often suggest much often safe context simple way gauge use psychoactive substance parent caring adult open respectful relationship young person one best resource way prevent harm substance use letting youth know approach time talk cannabis substance anything else concern say matter ready listen engage dialogue great place begin addressing anything might come young person way life canadian institute substance use research formerly carbc member bc partner mental health addiction information institute dedicated study substance use support communitywide effort aimed providing people access healthier life whether using substance visit wwwcisurca,21,261,False
whats difference mental health mental illness,mental health mental illness increasingly used mean thing everyone mental health like everyone health world health organization famously say health without mental health course lifetime people experience mental illness everyone struggle challenge mental wellbeing ie mental health like challenge physical wellbeing time time talk mental health talking mental wellbeing emotion thought feeling ability solve problem overcome difficulty social connection understanding world around u mental illness illness affect way people think feel behave interact others many different mental illness different symptom impact people life different way health isnt like onoff switch different degree health people move continuum ranging great good health soso health poor health illness disability example people good health problem going life people experience serious health problem poor health negative impact life people serious health problem last long time others serious health problem resolve quickly many people fall somewhere middletheyre generally good health though occasional problem may come mental health way someone feel unwell may serious illness people may poor mental health without mental illness day feel bit stressed overwhelmed something thats happening life important part good mental health ability look problem concern realistically good mental health isnt feeling happy confident time ignoring problem living coping well despite problem possible poor mental health mental illness entirely possible good mental health even diagnosis mental illness thats mental illness like health problem often episodic meaning time episode ill health time better good health right support tool anyone live wellhowever define welland find meaning contribute community work towards goal,6,247,False
find information depression,info sheet mood disorder bipolar disorder depression offer information mood problem treatment option resource bc also offer depression booklet audio plain language lower literacy reader take screening selftest depression mental health concern adult depression tool also screen sign bipolar disorder want go beyond basic managing depression series help deal diagnosis depression work doctor prevent relapse depression youll also find many experience perspective around depressionreading personal story help feel less alone,3,70,True
whats difference anxiety anxiety disorder,anxiety normal reaction many different kind event situation life anxiety one internal warning system alert u danger threat prepares body fight back get dangerous situation scientist call fight flight freeze response manageable amount anxiety time time helpful example motivate prepare test school finish task work even happy event like moving new home celebrating important milestone bring anxietyall part human anxiety problem becomes overwhelming unmanageable come unexpectedly anxiety disorder mental illness big impact life people may avoid going daily life order avoid anxiety may experience lot uncomfortable physical sensation physical health problem many people say know anxiety isnt based reality feel trapped thought feeling anxiety disorder treated important seek help youre concerned anxiety life normal anxiety related specific situation problem last long situation problemp proportional situation problemp realistic response realistic problem situationp someone experience anxiety disorder anxiety may come unexpectedly seemingly reason anxiety response situation problem may much stronger would expect may experience lot unrealistic anxiety fear situation likely never happen anxiety may last long time even situation problem resolved anxiety may feel impossible control manage may avoid situation thing believe trigger anxiety symptom here example normal anxiety anxiety disorder many people bit nervous flying totally normal reaction yet travel work get plane without problem someone anxiety disorder hand may able travel airporteven put job jeopardy formerly classified anxiety disorder currently classified trauma stressorrelated disorder formerly classified anxiety disorder currently classified obsessivecompulsive related disorder,5,233,True
whats difference anxiety stress,stress anxiety often used interchangeably overlap stress anxiety stress related fight flight freeze response anxiety physical sensation anxiety stress may similar cause stress anxiety usually different however stress focus mainly external pressure u finding hard cope stressed usually know stressed symptom stress typically disappear stressful situation anxiety hand isnt always easy figure anxiety focus worry fear thing could threaten u well anxiety anxiety stress anxiety part human problem last long time impact wellbeing daily life,4,75,True
whats difference sadness depression,sadness normal reaction loss disappointment problem difficult situation feeling sad time time another part human case feeling sadness go away quickly go daily life way talk sadness might feeling low feeling feeling blue person may say feeling depressed go away doesnt impact life big way probably isnt illness depression depression mental illness affect mood way understand way understand relate thing around also go different name clinical depression major depressive disorder major depression depression come reason last long time much sadness low mood people experience depression may feel worthless hopeless may feel unreasonable guilty people may experience depression anger irritability may hard concentrate make decision people lose interest thing used enjoy may isolate others also physical sign depression problem sleep appetite energy unexplainable ache pain may experience difficult thought death ending life suicide depression last longer two week doesnt usually go away impact life real illness treatable important seek help youre concerned depression,4,152,True
dysthymia persistent depressive disorder,dysthymia called persistent depressive disorder pdd mood disorder related depression major depressive disorder difference two number symptom amount time last someone diagnosed pdd would experience two four symptom least two year period wellness time someone diagnosed major depressive disorder would experience five symptom least two week symptom pdd include myth pdd severe illness major depressive disorder research show disability illness like ability work productively enjoy hobby may severe pdd major depressive disorder pdd involves smaller number symptom last long time many people begin assume pdd part personality rather illness effectively treated certainly talk doctor mental health professional think might pdd,4,100,False
cyclothymic disorder,cyclothymic disorder subtype bipolar disorder much like bipolar disorder symptom cyclothymia include three symptom hypomania five symptom depression like bipolar disorder people may experience wellness episode hypomania depression symptom hypomania include symptom depression include talk doctor mental health professional think might cyclothymic disorder,2,43,False
rapid cycling mean,rapid cycling mean someone diagnosed bipolar disorder depression experience four episode depression andor mania one year rapid cycling happen time someone experience bipolar disorderabout people diagnosed bipolar disorder experience rapid cycling point many case rapid cycling eventually go away people return pattern longer less frequent episode,3,46,False
find information help borderline personality disorder,borderline personality disorder bpd treatable illness made five group symptom around behaviour emotion relationship sense identity awareness read info sheet borderline personality disorder also entire issue vision journal bpd youll find information treatment support personal story people managing bpd living well borderline personality disorder society bc offer support group victoria resource library listing service bc vancouver dbt centre vancouver offer dialectical behaviour therapy dbt ad specializes helping people experience bpd offer individual group family counselling useful blog dbt skill several good helpful book available including,6,85,False
schizoid personality disorder,personality disorder pattern thought feeling behaviour last long time cause sort problem distress schizoid personality disorder spd affect social interaction relationship people spd may hard time relating others showing emotion may avoid close relationship prefer spend time alone seeming distant even close family member many people dont respond strong emotion like anger even others try provoke outside people spd may seem cold aloof showing little emotion similar name schizoid personality disorder isnt schizophrenia schizoid personality disorder believed relatively uncommon people spd may see part people may feel lot distress especially around social interaction medication may help people manage symptom psychotherapy may help people build new skill improve relationship find help schizoid personality disorder talk family doctor find psychologist bc psychological association call talk healthlink bc navigator,3,126,False
antisocial personality disorder,personality disorder pattern thought feeling behaviour last long time cause sort problem distress antisocial personality disorder aspd affect way people think right others someone aspd may disregard law expectation lack remorse hurt others break law make reckless decision believe superior others people may see someone aspd overly dramatic impulsive manipulative deceitful people may appear charming least surface like mental illness antisocial personality disorder spectrum people may occasionally act others may break law often spend lot time criminal justice system aspd diagnosed adult people aspd start problem conduct antisocial behaviour young age may diagnosed conduct disorder childhood treatment antisocial personality disorder usually psychotherapy help reduce harm aspd help people build empathy towards others aspd treatable may improve person approach middle age u hurt someone else acted without thinking others needed important remember antisocial personality disorder enduring pattern around lack empathy lack remorse doctor mental health professional diagnose illness like aspd find help antisocial personality disorder talk family doctor find psychologist bc psychological association call talk healthlink bc navigator,3,167,False
obsessivecompulsive personality disorder,personality disorder pattern thought feeling behaviour last long time cause sort problem distress obsessivecompulsive personality disorder ocpd control people ocpd inflexible thinking expect everything ordered perfect done correct way happens expense important thing life including relationship others work take priority every part life people ocpd may seem excessively dedicated may unable complete task due perfectionism may struggle delegate may distrust people contribution people ocpd may tolerate uncertainty may rigid understanding worldsomething either right wrong may also hard time spending money others may experience hoarding inability throw away item home conflict desire neatness order inability throw thing may cause lot anxiety obsessivecompulsive personality disorder obsessivecompulsive disorder ocd similar name illness people obsessivecompulsive disorder usually understand obsession compulsion illogical usually experience lot distress even though may able stop obsession compulsion compulsion attempt reduce anxiety find pleasure people obsessivecompulsive personality disorder may view thought part see thought logical may find pleasure benefit completing compulsive task may experience lot distress cant achieve control perfectionism want obsessivecompulsive personality disorder one common personality disorder treatment may include combination psychotherapy medication selfhelp strategy find help ocpd talk family doctor find psychologist bc psychological association call talk healthlink bc navigator,3,192,False
bingeeating disorder,bingeeating disorder bed type eating disorder involves episode eating lot food short amount time past point feeling full feeling control unable stop eating people experience bingeeating disorder may binge even dont feel hungry may feel temporarily comforted food feel depressed upset guilty ashamed eating result many people try keep bingeeating symptom secret cant tell someone experience bingeeating disorder way look way eat around others lot people experience eating much time feeling uncomfortable people experience bingeeating disorder experience many binge long period time bingeeating disorder treatable talk doctor mental health professional think might bingeeating disorder,2,94,False
whats difference dissociative identity disorder multiple personality disorder schizophrenia,sometimes people confuse dissociative identity disorder formerly known multiple personality disorder schizophrenia schizophrenia mean split mind name meant describe split reality experience episode psychosis well change thought emotion function dissociative identity disorder hand cause split fragmented understanding person sense dissociative identity disorder really fragmented identity many different personality develop people see different part part whole person people experience identity fragment may different characteristic including history identity mannerism key part dissociationfeeling detached world around people experience may many unexplainable gap memory forget information theyre already learned difficulty recalling thing theyve said done unlike portrayal tv movie may obvious others take lot time come diagnosis schizophrenia serious mental illness cause hallucination sensation arent real delusion belief cant possibly true addition symptom like jumbled thought jumbled speech difficulty expressing emotion people experience schizophrenia may hear feel thing arent real believe thing cant real arent separate identity,9,143,False
whats difference psychosis schizophrenia,psychosis syndrome group symptom someone experiencing episode psychosis break reality major symptom psychosis hallucination delusion hallucination sensation real hearing voice sound arent real hearing voice common hallucination hallucination experience sensehearing sight smell taste touch delusion strong belief cant possibly true common delusion include belief someone following monitoring belief extraordinary power ability symptom psychosis include difficulty concentrating completing task making decision thought may feel jumbled confused people hard time following conversation speaking clearly psychosis even affect way people move express emotion schizophrenia mental illness cause psychosis schizophrenia also symptom isnt cause psychosis case mental illness cause psychosis including depression bipolar disorder dementia borderline personality disorder psychosis may come time extreme stress major lack sleep trauma people using withdrawing certain drug medication may experience psychosis psychosis may also caused brain injury neurological problem health problem psychosis part schizophrenia caused many thing psychosis schizophrenia treatable important seek help soon possible,4,147,False
positive negative symptom,positive negative symptom medical term two group symptom schizophrenia positive symptom add positive symptom include hallucination sensation arent real delusion belief cant real repetitive movement hard control negative symptom take away negative symptom include inability show emotion apathy difficulty talking withdrawing social situation relationship also third group symptom usually called cognitive symptom includes anything related thinking disorganized thought memory problem difficulty focus attention,3,63,False
prodrome,prodrome medical term early sign symptom illness health problem appear major sign symptom start psychosis group symptom found disorder like schizophrenia one illness specific prodrome psychosis prodrome sign symptom start full symptom like hallucination delusion appear common symptom prodrome psychosis include symptom found many mental illness isnt always clear time prodrome psychosis schizophrenia something else best seek help whenever concerned mental health loved one mental health psychosis schizophrenia much easier manage treat treatment start early,1,75,False
im adult think might adhd next,think attentiondeficithyperactivity disorder illness affect child last adulthoodand people arent diagnosed much later life adhd diagnosed like mental illness family doctor good place start family doctor may able assess mental health start treatment needed may refer specialized mental health service organization help find good resource find support canadian attention deficit hyperactivity disorder resource alliance caddra organization support health professional research adhd treat support people diagnosed adhd train professional public info section website youll find information adult adhd assessment process youll also find extensive resource recommended publication centre adhd awareness canada provides education advocacy canadian experience adhd section website adult including information symptom assessment treatment adhd workplace resource reading list chadd vancouver offer monthly support group adult vancouver area,6,118,False
whats difference substance use addiction,people tend use word addiction mean different thing addicted shopping might mean speaker like shop hand addicted might mean speaker think person completely unable control behaviour people use word psychoactive mindaltering substance like alcohol tobacco drug often assume drug dangerous power control human behaviour evidence however suggests quite different picture substance use clearly contribute health social problem substance beneficial people situation many people celebrate special occasion nice glass wine example people use tobacco powerful symbol cultural spiritual ceremony fact substance used human throughout history many reason feel good feel better improve performance culturalspiritual reason new experience substance use complicated good bad helpful think substance use along continuum beneficial use harmful use along middle continuum substance use may beneficial harmful enjoyable night friend feel little ill next day far end continuum people develop dependencethey need continually use drug order feel normal keep using even lead financial difficulty problem home work health problem legal problem general substance use problem cause problem othersand much use cause problem different different people different situation reason person us substance influence risk developing problem instance person us substance fun occasional social use may follow person us substance cope longterm problem social anxiety long lasting intense use may follow managing risk involves aware using impact use around u wisdom ancestor suggests guiding principlenot much often safe context,5,219,False
find help alcohol drug use problem,seeking make change way use substance like alcohol drug important step people able reduce substance use quit altogether selfhelp material u need support peoplefamily member friend health professional people struggling substance use problem right help depends many factor include type drug using much often health social situation course preference getting help doesnt mean giving control shaping path still one make final decision type degree change make one way get help talk doctor trust feel comfortable confiding arent comfortable talking person also get advice registered nurse along advice program service area calling healthlink bc since drug illegal many people worry might happen talk drug use important know case doctor protect privacyits law bc alcohol drug information referral service help find information treatment option support group resource throughout province free confidential available call alcohol drug information referral service lower mainland,6,138,False
